{
  "schemaVersion": "0.3.0",
  "updated": "2026-10-01",
  "records": [
    {
      "id": "design.identity",
      "requirement": "Stable identities, ordered ownership, rename, duplication, reparent and deletion",
      "designCoverage": "partial",
      "schemaCoverage": "partial",
      "runtimeStatus": "not-implemented",
      "relationships": [
        "page owns visual graph",
        "track targets node identity"
      ],
      "decisionRefs": [
        "docs/architecture/design/shared-document-model/relationships.md",
        "docs/architecture/design/shared-document-model/authoring.md",
        "docs/architecture/design/shared-document-model/worked-expectations.md"
      ],
      "remainingDesign": [
        "General deletion repair, duplicate-with-motion remapping, cross-page references, inactive-node cleanup and reparent conversion policy"
      ],
      "proofObligations": [
        "Rename/reparent preserve addressed references; duplicate remaps without collisions"
      ],
      "runtimeRefs": []
    },
    {
      "id": "design.definitions",
      "requirement": "Reusable definitions and placed component instances have distinct ownership",
      "designCoverage": "partial",
      "schemaCoverage": "partial",
      "runtimeStatus": "not-implemented",
      "relationships": [
        "instance references source/definition/version",
        "parameters belong to instance or definition"
      ],
      "decisionRefs": [
        "docs/architecture/design/shared-document-model/relationships.md",
        "docs/architecture/design/shared-document-model/authoring.md",
        "docs/architecture/design/shared-document-model/worked-expectations.md"
      ],
      "remainingDesign": [
        "Definition discovery and implementation/visual-tree representation, conditional edit points, content fallback expansion, parameter migrations and version update admission"
      ],
      "proofObligations": [
        "One instance edit preserves other instances and definition source"
      ],
      "runtimeRefs": []
    },
    {
      "id": "design.defaults",
      "requirement": "Smart defaults and local overrides preserve typed references and reset by absence",
      "designCoverage": "partial",
      "schemaCoverage": "partial",
      "runtimeStatus": "not-implemented",
      "relationships": [
        "kind profile -> definition -> node -> scene -> evaluated motion"
      ],
      "decisionRefs": [
        "docs/architecture/design/shared-document-model/relationships.md",
        "docs/architecture/design/shared-document-model/authoring.md",
        "docs/architecture/design/shared-document-model/worked-expectations.md"
      ],
      "remainingDesign": [
        "Defaults for sequence/scene/media records and conditional/layout-dependent consumers; profile support for non-root parts"
      ],
      "proofObligations": [
        "Literal zero survives; reset removes binding and restores default/reference; invalid present value refuses"
      ],
      "runtimeRefs": []
    },
    {
      "id": "design.tokens",
      "requirement": "Designer and Animator share authored token sources in the same Git project",
      "designCoverage": "partial",
      "schemaCoverage": "partial",
      "runtimeStatus": "not-implemented",
      "relationships": [
        "manifest selects sources/revisions/context",
        "bindings address source and token path"
      ],
      "decisionRefs": [
        "docs/architecture/design/shared-document-model/relationships.md",
        "docs/architecture/design/shared-document-model/authoring.md",
        "docs/architecture/design/shared-document-model/worked-expectations.md"
      ],
      "remainingDesign": [
        "DTCG import/export coverage, alias and composite validation, Resolver contexts, watching, collisions and unsaved-source custody"
      ],
      "proofObligations": [
        "Source round trip preserves references/metadata; token update reaches both views; cycle/missing ref rejects atomically"
      ],
      "runtimeRefs": []
    },
    {
      "id": "design.pages",
      "requirement": "Workspace pages, application pages, frames and reusable components remain distinct",
      "designCoverage": "partial",
      "schemaCoverage": "partial",
      "runtimeStatus": "not-implemented",
      "relationships": [
        "workspace page owns JSONL",
        "frame owns spatial container"
      ],
      "decisionRefs": [
        "docs/architecture/design/shared-document-model/relationships.md"
      ],
      "remainingDesign": [
        "Application route/doc object representation and adapter-owned source mappings"
      ],
      "proofObligations": [
        "Creating frame/page changes no application route or component source"
      ],
      "runtimeRefs": []
    },
    {
      "id": "design.scenes",
      "requirement": "A scene is a local temporal composition referencing a visual root",
      "designCoverage": "partial",
      "schemaCoverage": "partial",
      "runtimeStatus": "not-implemented",
      "relationships": [
        "scene -> composition identity",
        "composition -> explicit local members and root",
        "instance -> shared definition; local bindings and supplied slots"
      ],
      "decisionRefs": [
        "docs/architecture/design/shared-document-model/relationships.md",
        "docs/architecture/design/shared-document-model/authoring.md",
        "docs/architecture/design/shared-document-model/worked-expectations.md"
      ],
      "remainingDesign": [
        "Scene creation/duplication and reusable composition instances; simultaneous evaluation isolation and storyboard representative sampling"
      ],
      "proofObligations": [
        "Editing one independent composition does not mutate another consumer; deliberate composition sharing shares base edits while scene tracks remain isolated"
      ],
      "runtimeRefs": []
    },
    {
      "id": "design.sequences",
      "requirement": "Sequences arrange identified scene occurrences independently of storyboard layout",
      "designCoverage": "specified",
      "schemaCoverage": "represented",
      "runtimeStatus": "not-implemented",
      "relationships": [
        "sequence owns occurrence ordering/placement",
        "occurrence references scene and trim interval"
      ],
      "decisionRefs": [
        "docs/architecture/design/shared-document-model/relationships.md"
      ],
      "remainingDesign": [],
      "proofObligations": [
        "Repeated scene uses distinct occurrence identities; trims map to declared scene-local time"
      ],
      "runtimeRefs": []
    },
    {
      "id": "design.transitions",
      "requirement": "Transitions explicitly connect occurrences and declare cross-scene continuity",
      "designCoverage": "partial",
      "schemaCoverage": "partial",
      "runtimeStatus": "not-implemented",
      "relationships": [
        "transition references neighboring occurrences"
      ],
      "decisionRefs": [
        "docs/architecture/design/shared-document-model/relationships.md"
      ],
      "remainingDesign": [
        "Overlap, blend, correspondence, shared-root isolation, lifecycle and retained state across transitions"
      ],
      "proofObligations": [
        "Cut obeys intervals; future continuity never inferred from labels or definition reuse"
      ],
      "runtimeRefs": []
    },
    {
      "id": "design.base-motion",
      "requirement": "Authored base values remain separate from evaluated animated values",
      "designCoverage": "specified",
      "schemaCoverage": "represented",
      "runtimeStatus": "not-implemented",
      "relationships": [
        "composition base -> implicit start",
        "selected property key owns its authored value",
        "last key -> derived terminal hold; no saved base mutation"
      ],
      "decisionRefs": [
        "docs/architecture/design/shared-document-model/relationships.md",
        "docs/architecture/design/shared-document-model/authoring.md",
        "docs/architecture/design/shared-document-model/worked-expectations.md"
      ],
      "remainingDesign": [],
      "proofObligations": [
        "Static scenes and implicit/explicit starts match independent samples; selected-key edits preserve base; terminal hold and scrubbing never author values"
      ],
      "runtimeRefs": []
    },
    {
      "id": "design.timing",
      "requirement": "Timing has explicit units, a timebase, scene-local keys and token time movement policy",
      "designCoverage": "partial",
      "schemaCoverage": "partial",
      "runtimeStatus": "not-implemented",
      "relationships": [
        "duration binding -> exact ticks",
        "scene local time -> sequence occurrence time"
      ],
      "decisionRefs": [
        "docs/architecture/design/shared-document-model/relationships.md",
        "docs/architecture/design/shared-document-model/authoring.md",
        "docs/architecture/design/shared-document-model/worked-expectations.md"
      ],
      "remainingDesign": [
        "Frame/rational sampling, rounding, interpolation precision, token time bounds reconciliation and recipe retiming"
      ],
      "proofObligations": [
        "Independent linear samples match the worked expectations; time-token changes move addressed keys and report order/bounds incompatibility without resizing the scene"
      ],
      "runtimeRefs": []
    },
    {
      "id": "design.track-conflicts",
      "requirement": "Competing tracks produce a declared inspectable result",
      "designCoverage": "partial",
      "schemaCoverage": "partial",
      "runtimeStatus": "not-implemented",
      "relationships": [
        "track addresses scene/node/property"
      ],
      "decisionRefs": [
        "docs/architecture/design/shared-document-model/relationships.md",
        "docs/architecture/design/shared-document-model/authoring.md",
        "docs/architecture/design/shared-document-model/worked-expectations.md"
      ],
      "remainingDesign": [